{
  "title": "Clickup VS AFFiNE: #1 Project Management Platform",
  "authors": [
    "AFFiNE"
  ],
  "tags": [
    "Content"
  ],
  "description": "Notion is a popular note-taking and collaboration tool that has gained a lot of attention in recent years. However, it's not the only option out there.",
  "created": 1679443200000,
  "updated": 1679443200000,
  "layout": "blog",
  "id": "wYOM9sz12O",
  "slug": "clickup-vs-affine-no1-project-manahement-platform",
  "cover": null,
  "md": "---\n\ntitle: \"Clickup VS AFFiNE: #1 Project Management Platform\"\n\nauthor: AFFiNE\n\ntags: Content\n\nslug: clickup-vs-affine-no1-project-manahement-platform\n\ndescription: Notion is a popular note-taking and collaboration tool that has gained a lot of attention in recent years. However, it's not the only option out there.\n\ncreated: 2023-03-22\n\nupdated: 2023-03-22\n\nlayout: blog\n\npublish: false\n\n---\n\n\n\n# ClickUp vs AFFiNE: #1 Project Management Platform\n\nIf you're looking for a project management platform, you've probably come across ClickUp and AFFiNE. Both platforms offer powerful tools for managing tasks, collaborating with teams, and organizing projects. In this article, we'll compare ClickUp and AFFiNE to help you decide which platform is the best fit for your needs.\n\n## AFFiNE\n\nAFFiNE is a next-generation knowledge base that serves as an open source, privacy-focused, local-first alternative to Notion. With AFFiNE, you can create workspaces and docs in plain text, Markdown, and blocks, including text, headings, images, databases, to-do lists, and numbered lists. AFFiNE offers seamless switching between Paper and Edgeless modes, empowering your workspace with powerful benefits such as online synchronization, multiplayer collaboration, and the ability to share your workspaces online with others. AFFiNE's flexibility and customizability make it a great choice for teams looking to streamline their workflow and collaboration.\n\n## ClickUp\n\nClickUp is a popular project management platform that offers a wide range of features, including task management, time tracking, and project analytics. ClickUp's interface is user-friendly, and it offers a customizable dashboard and a wide range of integrations. ClickUp also offers automation features and templates, making it easy to set up your workflow and collaborate with your team.\n\n## Comparison\n\nWhen it comes to features, both AFFiNE and ClickUp offer a lot of tools and customization options. However, there are some key differences between the two platforms.\n\nOne of the biggest differences is that AFFiNE is a local-first platform, while ClickUp is a cloud-based platform. This means that AFFiNE stores your data locally on your device, while ClickUp stores your data in the cloud. This can be an important consideration for teams who prioritize privacy and security.\n\nAnother key difference is that AFFiNE offers a truly freeform canvas in Edgeless mode, while ClickUp offers a more structured interface. This can make AFFiNE a better choice for teams who want a more creative and flexible workspace.\n\nIn terms of collaboration, both platforms offer multiplayer collaboration, but AFFiNE's local-first approach means that teams can collaborate offline without an internet connection.\n\n## Conclusion\n\nIn conclusion, both ClickUp and AFFiNE are great project management platforms, but they have different strengths and weaknesses. ClickUp offers a more structured and cloud-based approach, making it a great choice for teams who need a powerful and user-friendly platform. On the other hand, AFFiNE offers a local-first and highly customizable platform, making it a great choice for teams who prioritize privacy, flexibility, and creativity. Ultimately, the choice between ClickUp and AFFiNE will depend on your specific needs and preferences.\n\n",
  "publish": false,
  "order": 100
}